{
  "$id": "https://liapoldus.github.io/spec/server/http-stream.v1.schema.json",
  "$schema": "https://json-schema.org/draft/2020-12/schema",
  "additionalProperties": false,
  "properties": {
    "dataField": {
      "const": "data"
    },
    "headersField": {
      "const": "headers"
    },
    "kindField": {
      "const": "kind"
    },
    "maxChunkBytes": {
      "minimum": 1,
      "type": "integer"
    },
    "maxFrameBytes": {
      "minimum": 1,
      "type": "integer"
    },
    "requestChunkKind": {
      "minLength": 1,
      "type": "string"
    },
    "requestEndKind": {
      "minLength": 1,
      "type": "string"
    },
    "requestField": {
      "const": "request"
    },
    "requestStartKind": {
      "minLength": 1,
      "type": "string"
    },
    "responseChunkKind": {
      "minLength": 1,
      "type": "string"
    },
    "responseEndKind": {
      "minLength": 1,
      "type": "string"
    },
    "responseStartKind": {
      "minLength": 1,
      "type": "string"
    },
    "sse": {
      "additionalProperties": false,
      "properties": {
        "contentType": {
          "const": "text/event-stream"
        },
        "contentTypeHeader": {
          "const": "Content-Type"
        },
        "dataField": {
          "const": "data"
        },
        "dataPrefix": {
          "const": "data: "
        },
        "eventField": {
          "const": "event"
        },
        "eventKind": {
          "const": "sse_event"
        },
        "eventPrefix": {
          "const": "event: "
        },
        "eventTerminator": {
          "const": "\n"
        },
        "idField": {
          "const": "id"
        },
        "idPrefix": {
          "const": "id: "
        },
        "lineEnding": {
          "const": "\n"
        },
        "maxRetryMillis": {
          "maximum": 2147483647,
          "minimum": 0,
          "type": "integer"
        },
        "retryField": {
          "const": "retry"
        },
        "retryPrefix": {
          "const": "retry: "
        }
      },
      "required": [
        "eventKind",
        "contentType",
        "contentTypeHeader",
        "eventField",
        "dataField",
        "idField",
        "retryField",
        "eventPrefix",
        "dataPrefix",
        "idPrefix",
        "retryPrefix",
        "lineEnding",
        "eventTerminator",
        "maxRetryMillis"
      ],
      "type": "object"
    },
    "statusField": {
      "const": "status"
    },
    "version": {
      "const": 1
    },
    "websocket": {
      "additionalProperties": false,
      "properties": {
        "acceptField": {
          "minLength": 1,
          "type": "string"
        },
        "binaryMessageType": {
          "minLength": 1,
          "type": "string"
        },
        "closeKind": {
          "minLength": 1,
          "type": "string"
        },
        "codeField": {
          "minLength": 1,
          "type": "string"
        },
        "defaultRejectStatus": {
          "maximum": 599,
          "minimum": 400,
          "type": "integer"
        },
        "handshakeKind": {
          "minLength": 1,
          "type": "string"
        },
        "maxMessageBytes": {
          "minimum": 1,
          "type": "integer"
        },
        "messageChunkKind": {
          "minLength": 1,
          "type": "string"
        },
        "messageEndKind": {
          "minLength": 1,
          "type": "string"
        },
        "messageStartKind": {
          "minLength": 1,
          "type": "string"
        },
        "messageTypeField": {
          "minLength": 1,
          "type": "string"
        },
        "reasonField": {
          "minLength": 1,
          "type": "string"
        },
        "requestField": {
          "minLength": 1,
          "type": "string"
        },
        "subprotocolField": {
          "minLength": 1,
          "type": "string"
        },
        "subprotocolsField": {
          "minLength": 1,
          "type": "string"
        },
        "textMessageType": {
          "minLength": 1,
          "type": "string"
        }
      },
      "required": [
        "maxMessageBytes",
        "requestField",
        "handshakeKind",
        "acceptField",
        "subprotocolsField",
        "subprotocolField",
        "messageStartKind",
        "messageChunkKind",
        "messageEndKind",
        "messageTypeField",
        "textMessageType",
        "binaryMessageType",
        "closeKind",
        "codeField",
        "reasonField",
        "defaultRejectStatus"
      ],
      "type": "object"
    }
  },
  "required": [
    "version",
    "kindField",
    "dataField",
    "requestField",
    "statusField",
    "headersField",
    "maxChunkBytes",
    "maxFrameBytes",
    "requestStartKind",
    "requestChunkKind",
    "requestEndKind",
    "responseStartKind",
    "responseChunkKind",
    "responseEndKind",
    "websocket",
    "sse"
  ],
  "title": "Server service HTTP stream envelope contract",
  "type": "object"
}
