{
  "dataField": "data",
  "headersField": "headers",
  "kindField": "kind",
  "maxChunkBytes": 24000,
  "maxFrameBytes": 32768,
  "requestChunkKind": "request_chunk",
  "requestEndKind": "request_end",
  "requestField": "request",
  "requestStartKind": "request_start",
  "responseChunkKind": "response_chunk",
  "responseEndKind": "response_end",
  "responseStartKind": "response_start",
  "sse": {
    "contentType": "text/event-stream",
    "contentTypeHeader": "Content-Type",
    "dataField": "data",
    "dataPrefix": "data: ",
    "eventField": "event",
    "eventKind": "sse_event",
    "eventPrefix": "event: ",
    "eventTerminator": "\n",
    "idField": "id",
    "idPrefix": "id: ",
    "lineEnding": "\n",
    "maxRetryMillis": 2147483647,
    "retryField": "retry",
    "retryPrefix": "retry: "
  },
  "statusField": "status",
  "version": 1,
  "websocket": {
    "acceptField": "accept",
    "binaryMessageType": "binary",
    "closeKind": "websocket_close",
    "codeField": "code",
    "defaultRejectStatus": 403,
    "handshakeKind": "websocket_handshake",
    "maxMessageBytes": 1048576,
    "messageChunkKind": "websocket_message_chunk",
    "messageEndKind": "websocket_message_end",
    "messageStartKind": "websocket_message_start",
    "messageTypeField": "messageType",
    "reasonField": "reason",
    "requestField": "websocket",
    "subprotocolField": "subprotocol",
    "subprotocolsField": "subprotocols",
    "textMessageType": "text"
  }
}
